{
  "$schema": "https://json-schema.org/draft/2020-12/schema",
  "$id": "conformance-report.schema.json",
  "title": "Agent Contract Conformance Report v1",
  "type": "object",
  "additionalProperties": false,
  "required": [
    "report_version", "contract_version", "phase_scope", "source_revision", "generated_at", "environment",
    "gate_decision", "gate_reasons", "runtime_conformance", "legacy_characterization_status",
    "schema_validation_results", "scenario_plane_results", "requirement_coverage", "vocabulary_coverage",
    "join_invariant_results", "happens_before_results", "pairwise_coverage", "seam_coverage",
    "corpus_coverage", "determinism_runs", "http_sse_harness_results", "frontend_baseline_results",
    "known_legacy_defects", "missing_assets", "artifact_hashes", "reviews"
  ],
  "properties": {
    "report_version": {"const": "1.0"},
    "contract_version": {"const": "agent/v1"},
    "phase_scope": {"const": "0A"},
    "source_revision": {"type": "string", "pattern": "^[a-f0-9]{40}$"},
    "generated_at": {"type": "string", "format": "date-time"},
    "environment": {"type": "object"},
    "gate_decision": {"enum": ["go", "no_go"]},
    "gate_reasons": {"type": "array", "items": {"type": "string", "minLength": 1}},
    "runtime_conformance": {"enum": ["not_implemented", "conformant", "nonconformant"]},
    "legacy_characterization_status": {"enum": ["not_started", "in_progress", "complete"]},
    "schema_validation_results": {"$ref": "#/$defs/checks"},
    "scenario_plane_results": {"$ref": "#/$defs/checks"},
    "requirement_coverage": {"$ref": "#/$defs/coverage"},
    "vocabulary_coverage": {"$ref": "#/$defs/coverage"},
    "join_invariant_results": {"$ref": "#/$defs/checks"},
    "happens_before_results": {"$ref": "#/$defs/checks"},
    "pairwise_coverage": {"$ref": "#/$defs/coverage"},
    "seam_coverage": {"$ref": "#/$defs/coverage"},
    "corpus_coverage": {"$ref": "#/$defs/coverage"},
    "determinism_runs": {
      "type": "array",
      "minItems": 2,
      "items": {"$ref": "#/$defs/determinismRun"}
    },
    "http_sse_harness_results": {"$ref": "#/$defs/checks"},
    "frontend_baseline_results": {"$ref": "#/$defs/checks"},
    "known_legacy_defects": {"type": "array", "items": {"type": "object"}},
    "missing_assets": {"type": "array", "items": {"type": "string", "minLength": 1}},
    "artifact_hashes": {"type": "object", "additionalProperties": {"type": "string", "pattern": "^sha256:[a-f0-9]{64}$"}},
    "reviews": {"type": "array", "items": {"type": "object"}}
  },
  "$defs": {
    "checks": {
      "type": "array",
      "items": {
        "type": "object",
        "additionalProperties": false,
        "required": ["id", "status", "evidence_mode", "gate_required", "detail"],
        "properties": {
          "id": {"type": "string", "minLength": 1},
          "status": {"enum": ["pass", "fail", "not_run", "future_phase"]},
          "evidence_mode": {"enum": ["automated", "manual_observation", "not_available"]},
          "gate_required": {"type": "boolean"},
          "detail": {"type": "string"}
        }
      }
    },
    "coverage": {
      "type": "object",
      "additionalProperties": false,
      "required": ["status", "covered", "required", "missing"],
      "properties": {
        "status": {"enum": ["complete", "incomplete", "future_phase"]},
        "covered": {"type": "integer", "minimum": 0},
        "required": {"type": "integer", "minimum": 0},
        "missing": {"type": "array", "items": {"type": "string"}}
      }
    },
    "determinismRun": {
      "type": "object",
      "additionalProperties": false,
      "required": ["scenario", "run", "execution", "hash_seed", "timezone", "canonical_match"],
      "properties": {
        "scenario": {"type": "string", "pattern": "^GT[0-9]{2}-[a-z0-9-]+$"},
        "run": {"type": "integer", "minimum": 1},
        "execution": {"enum": ["in_process", "fresh_process"]},
        "hash_seed": {"type": ["string", "null"]},
        "timezone": {"type": "string", "minLength": 1},
        "canonical_match": {"type": "boolean"}
      }
    }
  }
}
