{
  "report_version": "1.0",
  "contract_version": "agent/v1",
  "phase_scope": "0A",
  "source_revision": "6c6594d42c08ae3757a72aa0e654a3fe555e4077",
  "generated_at": "2026-07-27T07:01:48Z",
  "environment": {"status": "contract_and_legacy_characterization_in_progress", "database": "real_file_sqlite_ten_variants_plus_isolated_browser_sqlite", "frontend": "vitest_build_and_loopback_browser_characterization_partial"},
  "gate_decision": "no_go",
  "gate_reasons": [
    "Required Legacy five-plane fixtures exist for 10 of 27 scenario variants; remaining variants are incomplete.",
    "Target-v1 runtime conformance is not implemented; the automated success-terminal probe is limited to GT01 plain chat.",
    "Browser characterization found a mobile layout failure; automated desktop replay, feedback rollback, Citation, Handoff, and Scheduled Draft confirmation remain uncovered."
  ],
  "runtime_conformance": "not_implemented",
  "legacy_characterization_status": "in_progress",
  "schema_validation_results": [{"id": "machine_contract_schemas", "status": "pass", "evidence_mode": "automated", "gate_required": true, "detail": "All 21 Draft 2020-12 schemas and 12 registered instances passed backend/tests/agent_golden; manifest orphan/duplicate checks, owned payload path resolution, recursive forbidden-key checks, and manifest-pinned Legacy field observations also passed."}],
  "scenario_plane_results": [
    {"id": "captured_legacy_variants", "status": "pass", "evidence_mode": "automated", "gate_required": true, "detail": "GT01 sync/SSE/feedback-refresh-toggle, GT02 ask-refresh-continue, GT03 true/false branches, GT04 parallel merge, GT13 LLM error, GT15 full, and GT16 History have 50 checked-in five-plane envelopes and independent runtime recapture."},
    {"id": "remaining_GT01-GT17_variants", "status": "not_run", "evidence_mode": "not_available", "gate_required": true, "detail": "Five-plane fixture envelopes remain missing for 17 of 27 catalog variants."}
  ],
  "requirement_coverage": {"status": "incomplete", "covered": 0, "required": 29, "missing": ["runtime_assertions"]},
  "vocabulary_coverage": {"status": "complete", "covered": 1, "required": 1, "missing": []},
  "join_invariant_results": [
    {"id": "captured_legacy_cross_plane_joins", "status": "pass", "evidence_mode": "automated", "gate_required": true, "detail": "Required per-variant relationships, profile-pinned endpoint roles/path patterns/semantic qualifiers, unique non-self references, durable SSE-to-DB event_id joins, feedback target-to-History/API-response joins, attachment request-to-History joins, and public Event API graph transition/pending snapshots-to-SQLite joins pass for all ten captured variants. GT03/GT04 also retain explicit persisted pre/post Session evidence."},
    {"id": "remaining_legacy_cross_plane_joins", "status": "not_run", "evidence_mode": "not_available", "gate_required": true, "detail": "Join evidence remains absent for uncaptured variants."}
  ],
  "happens_before_results": [
    {"id": "GT13_error_boundary_visibility", "status": "pass", "evidence_mode": "automated", "gate_required": true, "detail": "A real loopback socket probe observes user-only History at error_occurred and assistant History visibility by stream_end, followed by clean close without complete."},
    {"id": "success_terminal_visibility", "status": "pass", "evidence_mode": "automated", "gate_required": true, "detail": "A deterministic commit-barrier probe over loopback Uvicorn proves GT01 plain-chat stream_end precedes commit, complete is absent while commit is blocked, and the non-empty durable complete SSE id is observed exactly once before a single independent History read returns the committed user and assistant messages with matching reply and turn identity. This evidence does not cover other success branches."}
  ],
  "pairwise_coverage": {"status": "complete", "covered": 1, "required": 1, "missing": []},
  "seam_coverage": {"status": "incomplete", "covered": 1, "required": 2, "missing": ["monkeypatch_reference_scan"]},
  "corpus_coverage": {"status": "complete", "covered": 3, "required": 3, "missing": []},
  "determinism_runs": [
    {"scenario": "GT01-sync", "run": 1, "execution": "in_process", "hash_seed": null, "timezone": "controlled_utc_clock", "canonical_match": true},
    {"scenario": "GT01-sync", "run": 2, "execution": "fresh_process", "hash_seed": "1", "timezone": "UTC", "canonical_match": true},
    {"scenario": "GT01-sync", "run": 3, "execution": "fresh_process", "hash_seed": "777", "timezone": "America/New_York", "canonical_match": true},
    {"scenario": "GT01-sse", "run": 1, "execution": "in_process", "hash_seed": null, "timezone": "controlled_utc_clock", "canonical_match": true},
    {"scenario": "GT01-sse", "run": 2, "execution": "fresh_process", "hash_seed": "1", "timezone": "UTC", "canonical_match": true},
    {"scenario": "GT01-sse", "run": 3, "execution": "fresh_process", "hash_seed": "777", "timezone": "America/New_York", "canonical_match": true},
    {"scenario": "GT01-feedback-refresh-toggle", "run": 1, "execution": "in_process", "hash_seed": null, "timezone": "controlled_utc_clock", "canonical_match": true},
    {"scenario": "GT01-feedback-refresh-toggle", "run": 2, "execution": "fresh_process", "hash_seed": "1", "timezone": "UTC", "canonical_match": true},
    {"scenario": "GT01-feedback-refresh-toggle", "run": 3, "execution": "fresh_process", "hash_seed": "777", "timezone": "America/New_York", "canonical_match": true},
    {"scenario": "GT02-ask-refresh-continue", "run": 1, "execution": "in_process", "hash_seed": null, "timezone": "controlled_utc_clock", "canonical_match": true},
    {"scenario": "GT02-ask-refresh-continue", "run": 2, "execution": "fresh_process", "hash_seed": "1", "timezone": "UTC", "canonical_match": true},
    {"scenario": "GT02-ask-refresh-continue", "run": 3, "execution": "fresh_process", "hash_seed": "777", "timezone": "America/New_York", "canonical_match": true},
    {"scenario": "GT03-true", "run": 1, "execution": "in_process", "hash_seed": null, "timezone": "controlled_utc_clock", "canonical_match": true},
    {"scenario": "GT03-true", "run": 2, "execution": "fresh_process", "hash_seed": "1", "timezone": "UTC", "canonical_match": true},
    {"scenario": "GT03-true", "run": 3, "execution": "fresh_process", "hash_seed": "777", "timezone": "America/New_York", "canonical_match": true},
    {"scenario": "GT03-false", "run": 1, "execution": "in_process", "hash_seed": null, "timezone": "controlled_utc_clock", "canonical_match": true},
    {"scenario": "GT03-false", "run": 2, "execution": "fresh_process", "hash_seed": "1", "timezone": "UTC", "canonical_match": true},
    {"scenario": "GT03-false", "run": 3, "execution": "fresh_process", "hash_seed": "777", "timezone": "America/New_York", "canonical_match": true},
    {"scenario": "GT04-merge", "run": 1, "execution": "in_process", "hash_seed": null, "timezone": "controlled_utc_clock", "canonical_match": true},
    {"scenario": "GT04-merge", "run": 2, "execution": "fresh_process", "hash_seed": "1", "timezone": "UTC", "canonical_match": true},
    {"scenario": "GT04-merge", "run": 3, "execution": "fresh_process", "hash_seed": "777", "timezone": "America/New_York", "canonical_match": true},
    {"scenario": "GT13-llm-error", "run": 1, "execution": "in_process", "hash_seed": null, "timezone": "controlled_utc_clock", "canonical_match": true},
    {"scenario": "GT13-llm-error", "run": 2, "execution": "fresh_process", "hash_seed": "1", "timezone": "UTC", "canonical_match": true},
    {"scenario": "GT13-llm-error", "run": 3, "execution": "fresh_process", "hash_seed": "777", "timezone": "America/New_York", "canonical_match": true},
    {"scenario": "GT15-full", "run": 1, "execution": "in_process", "hash_seed": null, "timezone": "controlled_utc_clock", "canonical_match": true},
    {"scenario": "GT15-full", "run": 2, "execution": "fresh_process", "hash_seed": "1", "timezone": "UTC", "canonical_match": true},
    {"scenario": "GT15-full", "run": 3, "execution": "fresh_process", "hash_seed": "777", "timezone": "America/New_York", "canonical_match": true},
    {"scenario": "GT16-history", "run": 1, "execution": "in_process", "hash_seed": null, "timezone": "controlled_utc_clock", "canonical_match": true},
    {"scenario": "GT16-history", "run": 2, "execution": "fresh_process", "hash_seed": "1", "timezone": "UTC", "canonical_match": true},
    {"scenario": "GT16-history", "run": 3, "execution": "fresh_process", "hash_seed": "777", "timezone": "America/New_York", "canonical_match": true}
  ],
  "http_sse_harness_results": [
    {"id": "real_fastapi_testclient_sqlite", "status": "pass", "evidence_mode": "automated", "gate_required": true, "detail": "GT01 sync/SSE, backend feedback persistence/clear and invalid-rating semantics, GT13 error, GT15 draft confirm rollback, and GT16 attachment History use real auth, routers, file SQLite, persistence, SSE relay, and History."},
    {"id": "real_socket_disconnect_cancel_and_terminal_boundaries", "status": "pass", "evidence_mode": "automated", "gate_required": true, "detail": "Four loopback Uvicorn/socket tests cover transport disconnect recovery, exactly-one explicit stream_cancelled with stopped History, the GT13 error/stream_end History boundary, and deterministic GT01 plain-chat complete-to-committed-History visibility."}
  ],
  "frontend_baseline_results": [
    {"id": "official_chat_frontend_vitest", "status": "pass", "evidence_mode": "automated", "gate_required": true, "detail": "Six Vitest checks cover Citation/Draft/Attachment History consumers, feedback eligibility, terminal vocabulary, and Scheduled Draft confirm/dismiss clicks."},